{"candidate_id":"sha256:1111111111111111111111111111111111111111111111111111111111111111","candidate_inventory_sha256":"sha256:2222222222222222222222222222222222222222222222222222222222222222","distribution_file_count":8,"distribution_inventory_sha256":"sha256:3333333333333333333333333333333333333333333333333333333333333333","distribution_total_bytes":8388608,"file_count":25,"raw_zip_sha256":"sha256:4444444444444444444444444444444444444444444444444444444444444444","raw_zip_size_bytes":9437184,"release_identity_id":"sha256:3d52af3a2bc6eb185a48465c8680d988a57f7fecf668313673ded1aaed3a59ab","schema":"dpone.release-controller-pypi-materialization-proof.v1","schema_version":1,"tag":"v0.74.0"}